{
  "schema_version": "0.2.0",
  "migrated_from": "0.1.0",
  "migrated_on": "2026-09-22",
  "relationships": [
    {
      "schema_version": "0.2.0",
      "source": "Loofy147/Software-res",
      "target": "Loofy147/canonical-capability-core",
      "relation": "RESEARCH_SOURCE",
      "status": "DERIVED",
      "confidence": "medium",
      "evidence_refs": [
        "Software-res:README.md",
        "Software-res:RELEASE.md",
        "canonical-capability-core:CANONICAL_BASELINE.md"
      ],
      "notes": "Both implement evidence-governed decision/execution concepts; direct code lineage is not established yet.",
      "status_basis": "The relationship is derived from overlap across the cited repository surfaces; it is not direct lineage evidence.",
      "next_test": "Complete the discriminating verification stated by the relationship note before upgrading the epistemic status."
    },
    {
      "schema_version": "0.2.0",
      "source": "Loofy147/algeria-ai-product-fabric",
      "target": "Loofy147/canonical-capability-core",
      "relation": "COMPONENT_SOURCE",
      "status": "INFERRED",
      "confidence": "medium",
      "evidence_refs": [
        "algeria-ai-product-fabric:README.md",
        "canonical-capability-core:CANONICAL_BASELINE.md"
      ],
      "notes": "Potential composition/reuse relationship; imports and copied modules must be verified.",
      "status_basis": "The relationship is presented as a candidate inference in the recorded note and is not directly established.",
      "next_test": "Complete the discriminating verification stated by the relationship note before upgrading the epistemic status."
    },
    {
      "schema_version": "0.2.0",
      "source": "Loofy147/Healer-",
      "target": "Loofy147/-Fiber-Stratified-Optimization---FSO-",
      "relation": "SAME_IDEA",
      "status": "INFERRED",
      "confidence": "low",
      "evidence_refs": [
        "Healer-:README.md",
        "FSO:README.md"
      ],
      "notes": "FSO terminology is present in the contexts, but the FSO repository currently exposes insufficient content evidence.",
      "status_basis": "The recorded evidence supports a candidate relationship but explicitly leaves verification open.",
      "next_test": "Complete the discriminating verification stated by the relationship note before upgrading the epistemic status."
    },
    {
      "schema_version": "0.2.0",
      "source": "Loofy147/algeria-multi-agent-platform",
      "target": "Loofy147/algeria-multiagent-platform",
      "relation": "DUPLICATE_CANDIDATE",
      "status": "INFERRED",
      "confidence": "medium",
      "evidence_refs": [
        "algeria-multi-agent-platform:README.md",
        "algeria-multiagent-platform:README.md",
        "algeria-multi-agent-platform:ARCHITECTURE.md"
      ],
      "notes": "Near-identical naming and overlapping domain. Requires content/history comparison.",
      "status_basis": "The relationship is presented as a candidate inference in the recorded note and is not directly established.",
      "next_test": "Complete the discriminating verification stated by the relationship note before upgrading the epistemic status."
    },
    {
      "schema_version": "0.2.0",
      "source": "Loofy147/ai-meta-orchestrator",
      "target": "Loofy147/Unified-ai",
      "relation": "SAME_IDEA",
      "status": "DERIVED",
      "confidence": "low",
      "evidence_refs": [
        "ai-meta-orchestrator:root",
        "Unified-ai:README.md"
      ],
      "notes": "Both describe broad AI orchestration layers; implementation equivalence is not established.",
      "status_basis": "The relationship is derived from overlap across the cited repository surfaces; it is not direct lineage evidence.",
      "next_test": "Complete the discriminating verification stated by the relationship note before upgrading the epistemic status."
    },
    {
      "schema_version": "0.2.0",
      "source": "Loofy147/-AI-Driven-Crypto-Portfolio-Manager-",
      "target": "Loofy147/ai-meta-orchestrator",
      "relation": "COMPONENT_SOURCE",
      "status": "INFERRED",
      "confidence": "low",
      "evidence_refs": [
        "AI-Driven-Crypto-Portfolio-Manager:README.md",
        "ai-meta-orchestrator:root"
      ],
      "notes": "The trading project contains an orchestration layer; direct reuse is not yet verified.",
      "status_basis": "Legacy relationship claim preserved with an explicit non-observed epistemic state; further verification remains governed by the recorded notes.",
      "next_test": "Complete the discriminating verification stated by the relationship note before upgrading the epistemic status."
    },
    {
      "schema_version": "0.2.0",
      "source": "Loofy147/Global-structure-",
      "target": "Loofy147/Global-theorem-",
      "relation": "SAME_IDEA",
      "status": "DERIVED",
      "confidence": "high",
      "evidence_refs": [
        "Global-structure-:README.md",
        "Global-structure-:SYSTEM_MAP.md",
        "Global-theorem-:README.md",
        "Global-theorem-:docs/LAWS.md"
      ],
      "notes": "Both explicitly define TGI/FSO over Z_m^k, Hamiltonian/topological reasoning and the same algebraic framework. Code ancestry remains to be checked.",
      "status_basis": "The relationship is derived from overlap across the cited repository surfaces; it is not direct lineage evidence.",
      "next_test": "Complete the discriminating verification stated by the relationship note before upgrading the epistemic status."
    },
    {
      "schema_version": "0.2.0",
      "source": "Loofy147/Symmetric-HAG",
      "target": "Loofy147/Global-theorem-",
      "relation": "SAME_IDEA",
      "status": "OBSERVED",
      "confidence": "high",
      "evidence_refs": [
        "Symmetric-HAG:README.md"
      ],
      "notes": "Symmetric-HAG directly links to Global-theorem-. This is explicit cross-repository bridge evidence.",
      "status_basis": "The source note records an explicit repository-to-repository link.",
      "next_test": "Complete the discriminating verification stated by the relationship note before upgrading the epistemic status."
    },
    {
      "schema_version": "0.2.0",
      "source": "Loofy147/Symmetric-HAG",
      "target": "Loofy147/HAG",
      "relation": "SAME_IDEA",
      "status": "OBSERVED",
      "confidence": "high",
      "evidence_refs": [
        "Symmetric-HAG:README.md"
      ],
      "notes": "Symmetric-HAG directly links to HAG. This is explicit cross-repository bridge evidence.",
      "status_basis": "The source note records an explicit repository-to-repository link.",
      "next_test": "Complete the discriminating verification stated by the relationship note before upgrading the epistemic status."
    },
    {
      "schema_version": "0.2.0",
      "source": "Loofy147/HAG",
      "target": "Loofy147/Global-structure-",
      "relation": "SAME_IDEA",
      "status": "DERIVED",
      "confidence": "medium",
      "evidence_refs": [
        "HAG:ROADMAP.md",
        "HAG:HAG_Sovereign_Research_Paper.md",
        "Global-structure-:README.md"
      ],
      "notes": "HAG explicitly connects TGI, Closure Lemma and recursive self-improvement to sovereign desktop execution; exact implementation lineage is unverified.",
      "status_basis": "The source note records an explicit conceptual connection, while implementation lineage remains unverified.",
      "next_test": "Complete the discriminating verification stated by the relationship note before upgrading the epistemic status."
    },
    {
      "schema_version": "0.2.0",
      "source": "Loofy147/Healer-",
      "target": "Loofy147/Global-structure-",
      "relation": "SAME_IDEA",
      "status": "INFERRED",
      "confidence": "medium",
      "evidence_refs": [
        "Healer-:README.md",
        "Global-structure-:GEOMETRIC_CONSTRUCTION.md"
      ],
      "notes": "Healer describes FSC/FSO concepts and Global-structure contains the FSO geometric construction. Shared implementation not established.",
      "status_basis": "The recorded evidence supports a candidate relationship but explicitly leaves verification open.",
      "next_test": "Complete the discriminating verification stated by the relationship note before upgrading the epistemic status."
    },
    {
      "schema_version": "0.2.0",
      "source": "Loofy147/Sovereign-OS",
      "target": "Loofy147/HAG",
      "relation": "SAME_IDEA",
      "status": "DERIVED",
      "confidence": "low",
      "evidence_refs": [
        "Sovereign-OS:README.md",
        "HAG:README.md"
      ],
      "notes": "Both use sovereign, torus/kernel and autonomous execution concepts; direct lineage not established.",
      "status_basis": "The relationship is derived from overlap across the cited repository surfaces; it is not direct lineage evidence.",
      "next_test": "Complete the discriminating verification stated by the relationship note before upgrading the epistemic status."
    },
    {
      "schema_version": "0.2.0",
      "source": "Loofy147/STRATOS",
      "target": "Loofy147/Sovereign-OS",
      "relation": "SUCCESSOR",
      "status": "DERIVED",
      "confidence": "low",
      "evidence_refs": [
        "STRATOS:README.md",
        "Sovereign-OS:README.md"
      ],
      "notes": "Both present sovereign computing/OS architecture, but chronology and code lineage have not been compared.",
      "status_basis": "The relationship is derived from overlap across the cited repository surfaces; it is not direct lineage evidence.",
      "next_test": "Complete the discriminating verification stated by the relationship note before upgrading the epistemic status."
    },
    {
      "schema_version": "0.2.0",
      "source": "Loofy147/Meta-meta",
      "target": "Loofy147/-AI-Driven-Crypto-Portfolio-Manager-",
      "relation": "SAME_IDEA",
      "status": "DERIVED",
      "confidence": "medium",
      "evidence_refs": [
        "Meta-meta:README.md",
        "Meta-meta:root",